{"$schema":"https://json-schema.org/draft/2020-12/schema","$id":"https://synapse.kkloudtarus.net/docs/schemas/events/cspm.run_finished.v1.schema.json","title":"cspm.run_finished event (v1)","type":"object","properties":{"id":{"type":"string","minLength":1},"type":{"type":"string","const":"cspm.run_finished"},"source_kind":{"type":"string","minLength":1},"source_id":{"type":"string","minLength":1},"schema_version":{"type":"integer","const":1},"occurred_at":{"type":"string","format":"date-time"},"engagement_id":{"type":"string"},"severity":{"type":"string"},"data":{"type":"object","properties":{"title":{"type":"string"},"summary":{"type":"string"},"run_id":{"type":"string","minLength":1},"scan_id":{"type":"string","minLength":1},"engagement_id":{"type":"string","minLength":1},"scan_kind":{"type":"string","const":"cspm"},"outcome":{"type":"string","enum":["succeeded","failed","partial","cancelled","unknown"]},"provider":{"type":"string","minLength":1},"providers":{"type":"array"},"counts_available":{"type":"boolean"},"severity_counts_available":{"type":"boolean"},"total_count":{"type":"integer","minimum":0},"critical_count":{"type":"integer","minimum":0},"high_count":{"type":"integer","minimum":0},"medium_count":{"type":"integer","minimum":0},"low_count":{"type":"integer","minimum":0},"info_count":{"type":"integer","minimum":0},"error_code":{"type":"string"}},"required":["title","summary","run_id","engagement_id","scan_kind","outcome","provider","providers","counts_available","severity_counts_available"],"additionalProperties":true}},"required":["id","type","source_kind","source_id","schema_version","occurred_at","data"],"additionalProperties":true}
