{"id":"event-cspm-run","type":"cspm.run_finished","source_kind":"cspm_run","source_id":"cspm-42","schema_version":1,"occurred_at":"2026-10-10T08:00:00.123456789Z","engagement_id":"eng-42","severity":"info","data":{"title":"Cloud posture run finished","summary":"A cloud posture run completed.","run_id":"cspm-42","scan_id":"cspm-42","engagement_id":"eng-42","scan_kind":"cspm","outcome":"succeeded","provider":"aws","providers":["aws"],"counts_available":true,"severity_counts_available":false,"total_count":2,"error_code":""}}
